{
  "schemaVersion": "1.0.0",
  "status": "complete",
  "generatedAt": "2026-09-10T00:50:13.152Z",
  "generator": "project-understanding",
  "project": {
    "name": "project-skills-orchestrator",
    "displayName": "Project Orchestrator",
    "purpose": "Turn any repository into a governed GitHub Copilot workspace: agent instructions, scoped standards, reusable prompts, specialist agents, and 45 governed skills — installed consistently, verified after every run, and safe to rerun.",
    "evidence": [
      "README.md"
    ]
  },
  "scan": {
    "mode": "full-rebuild",
    "repositoryDigestSha256": "a84e660d0d2d64c64d542947bd9cda6d32eb9e87d59db2ea41aadc861e3fc55c",
    "fileCount": 296,
    "sourceFileCount": 20,
    "testFileCount": 13,
    "excludedDirectories": [
      ".git",
      ".skills-orchestrator",
      ".venv",
      "__pycache__",
      "bin",
      "build",
      "coverage",
      "dist",
      "node_modules",
      "obj",
      "out",
      "vendor",
      "venv"
    ],
    "excludedSensitivePatterns": [
      ".env and .env.*",
      "private key and certificate files",
      "credential and secret manifests",
      "SSH private keys"
    ],
    "files": [
      {
        "path": ".azure/environment.json",
        "bytes": 667,
        "sha256": "40a248bda9e856da6f7e0462e576d2e0b08d5943aa89ecad528dbfe8c021619f"
      },
      {
        "path": ".gitattributes",
        "bytes": 527,
        "sha256": "c63d80aee13e6990e327cc45b350697b1dd55d69e4db49535b0db92eb624d29d"
      },
      {
        "path": ".github/copilot-instructions.md",
        "bytes": 4215,
        "sha256": "5af1bfe699824ce7742da91c1f13d68ae7cff58c3c02b91e51a80a1fdd070500"
      },
      {
        "path": ".github/dependabot.yml",
        "bytes": 321,
        "sha256": "22aa5906dcdd7a7c4fbe797c9fef9d935fe2d721dadef9b681670ac53c3fb3ef"
      },
      {
        "path": ".github/prompts/azure-cleanup-help.prompt.md",
        "bytes": 1242,
        "sha256": "07ba1bbf4ef32754617a1a39cd4913b8bff2fdea1ec7c0ae2620516b803086d2"
      },
      {
        "path": ".github/prompts/demo-create-project.prompt.md",
        "bytes": 5606,
        "sha256": "1691eb5cb241e99c79cc36dc554298309952359a4a4b7d5eaadb793a6d5f05b9"
      },
      {
        "path": ".github/prompts/demo-web-app.prompt.md",
        "bytes": 8914,
        "sha256": "84589697433565e668fcac57c58844356e9795a78850557b394391057c9bfa1d"
      },
      {
        "path": ".github/prompts/environment-update-help.prompt.md",
        "bytes": 1035,
        "sha256": "5230f6db06f94db9ecd139daaee17f8fc371c66450d887e938dfa08ee54f3b1b"
      },
      {
        "path": ".github/prompts/project-blueprint.prompt.md",
        "bytes": 1724,
        "sha256": "9fb4789962429a753d693b27f22d39ee51943fe25e6942ce7b942e7b8751db9e"
      },
      {
        "path": ".github/prompts/project-mermaid-architecture.prompt.md",
        "bytes": 5569,
        "sha256": "a7c069fedc282dea917b29751ca0cf18fa7f1ab49166121b6f5baa41e520f129"
      },
      {
        "path": ".github/prompts/project-start.prompt.md",
        "bytes": 1507,
        "sha256": "e6e721eca59c0ca02202b010df9845218ff8d238caf3553ff8a69610484f828b"
      },
      {
        "path": ".github/prompts/project-validate.prompt.md",
        "bytes": 1520,
        "sha256": "d8c554e36c5cccff3d6da0387ac28107c0040717c885cf187263274c4ce2c5e6"
      },
      {
        "path": ".github/prompts/release-readiness.prompt.md",
        "bytes": 1242,
        "sha256": "72e58c3071b09bc67e4d18370fe39bdfb4e627888a07d9e64cd077764108cbed"
      },
      {
        "path": ".github/prompts/skills-help.prompt.md",
        "bytes": 2112,
        "sha256": "1407e49cb83aadd3efddcf41d64982b3f758d860a351a037dbe1acad2d1934ad"
      },
      {
        "path": ".github/skills/agent-builder/scripts/agent-builder.mjs",
        "bytes": 45545,
        "sha256": "b45d0d5e0abb8d54a1e3c75bff559c9ef446ee6276159b8def33421272c9f31a"
      },
      {
        "path": ".github/skills/agent-builder/scripts/azure-context.ps1",
        "bytes": 3944,
        "sha256": "44bfaf322fd8e901c3e4d3f9a3d928005385384e5cb6635c097eee6efeef9c25"
      },
      {
        "path": ".github/skills/agent-builder/SKILL.md",
        "bytes": 12066,
        "sha256": "1e6e2164a40a9e41c3fffe49617f4be3cfb49246b4fbde28c7605f10e6460832"
      },
      {
        "path": ".github/skills/architecture-review/SKILL.md",
        "bytes": 4720,
        "sha256": "e989ed7f3b6d07f5b9a08d1c65cb4a0721cdc4d0f2a9bb45fc2e55cce2b41919"
      },
      {
        "path": ".github/skills/artifact-upgrade/SKILL.md",
        "bytes": 3374,
        "sha256": "7a57ffff85bed1f233049405cf25e178a359aa6cf674b7da5e50ca69d60c3962"
      },
      {
        "path": ".github/skills/audit-azure-environment/SKILL.md",
        "bytes": 3303,
        "sha256": "48f95d09cc794e75ab7c0daaf3f19ed7dacd5658219dcec167e7cd21eec6a688"
      },
      {
        "path": ".github/skills/audit-code/config/gitleaks-allowlist.json",
        "bytes": 620,
        "sha256": "a5e1b50dc5b973dc3b582376ea1dfd3d170a4378a7e4a0df962635962c831976"
      },
      {
        "path": ".github/skills/audit-code/config/gitleaks.toml",
        "bytes": 184,
        "sha256": "59e92fcf9ecc85815802f170d3cd9a8736edaf4760b6b63cc8d1ad0b3c849463"
      },
      {
        "path": ".github/skills/audit-code/scripts/audit-evidence.mjs",
        "bytes": 9505,
        "sha256": "e668b8a59a99d00104aed630c6f1c1016bada9b2ae6a39f2c1712fc37704a4c8"
      },
      {
        "path": ".github/skills/audit-code/scripts/audit-validate.mjs",
        "bytes": 22829,
        "sha256": "298a9fac02b2229e79d57bd88005e8bee2a84a9c564d92e911eb2d26a6a634c0"
      },
      {
        "path": ".github/skills/audit-code/scripts/gitleaks-scan.mjs",
        "bytes": 15143,
        "sha256": "5deb7d0ca2ff6ecc34db4195997714f100304cf87984e3fa42490cbd124ef9c1"
      },
      {
        "path": ".github/skills/audit-code/scripts/safe-path.mjs",
        "bytes": 1282,
        "sha256": "7882e91022e22fd333685feecd87be2767ca8425f8a9c0c14bc24d61c89af2e3"
      },
      {
        "path": ".github/skills/audit-code/SKILL.md",
        "bytes": 15619,
        "sha256": "cb4fddb53a17db71cc49fd93fa75e05a6e2c6043f404e78f434328fee575dfa5"
      },
      {
        "path": ".github/skills/audit-plan-remediation/SKILL.md",
        "bytes": 5420,
        "sha256": "ae84fdd08f47987e57854c4a02117a129d7c0ed9b787f208eec15d7d3c48e6e9"
      },
      {
        "path": ".github/skills/audit-remediation/SKILL.md",
        "bytes": 10659,
        "sha256": "6eb930914a2b8ace35157855a9b43a917c99c0e25288fc18c704e0ae49cf9b66"
      },
      {
        "path": ".github/skills/audit-review-findings/SKILL.md",
        "bytes": 4995,
        "sha256": "2ea9b461ecff6dd9f3b2f405b51ab44f1b45951254f9c03fea437a394220f327"
      },
      {
        "path": ".github/skills/azure-cleanup/SKILL.md",
        "bytes": 4327,
        "sha256": "5f14d4abd25c254b9bec2ec5b8ac50d5c4be5f540e9ced2eff80fef045276720"
      },
      {
        "path": ".github/skills/azure-discovery/scripts/azure-discovery.ps1",
        "bytes": 11679,
        "sha256": "629d647593e8d72b4dea41db7f3796fa3856306d8ef39beb937adc8c9cb22c0d"
      },
      {
        "path": ".github/skills/azure-discovery/scripts/azure-environment.ps1",
        "bytes": 13682,
        "sha256": "b3877a999fc1d829fcb7998d3e66e3d4b9cea115983b7be8cd2671de20db4bc6"
      },
      {
        "path": ".github/skills/azure-discovery/SKILL.md",
        "bytes": 5655,
        "sha256": "35dd6cb64d63788c9b5228021fafb45689c4e6af611e11de4334fd9c8af94a6a"
      },
      {
        "path": ".github/skills/change-review/SKILL.md",
        "bytes": 3441,
        "sha256": "f286d235916b1ee83d9e33c8dbb110685edc982edd544f3ee153d8456f9d8c0e"
      },
      {
        "path": ".github/skills/ci-failure-triage/SKILL.md",
        "bytes": 3750,
        "sha256": "f24382bbcb7d4fc68e5728aa1d3085129ea3963f818daece80d539468a726f93"
      },
      {
        "path": ".github/skills/clarify-the-ask/SKILL.md",
        "bytes": 6461,
        "sha256": "d9329a1157b3bcc18d12a5ff0565c55df0dc71f1180e760bd3c05a60601e3c4a"
      },
      {
        "path": ".github/skills/dependency-maintenance/SKILL.md",
        "bytes": 4045,
        "sha256": "3f011cc2a872c4f4c688d5452b16f00c3c1f254342d53418f9c98ef10b30cd3a"
      },
      {
        "path": ".github/skills/deployment-review/SKILL.md",
        "bytes": 4847,
        "sha256": "26c74a856b0eb1bea94ad12e79509b64f55196b13bded3811fb06f7a1f40d86d"
      },
      {
        "path": ".github/skills/development-environment-readiness/SKILL.md",
        "bytes": 6729,
        "sha256": "f382eb7a63d5d0c2d346791b9a122ebf14c5963eb078c6f80a616a305e6e9871"
      },
      {
        "path": ".github/skills/documentation-builder/scripts/documentation-builder.mjs",
        "bytes": 8922,
        "sha256": "ead903a5f451e31ef696997c396b416b01083217d728daa1a97b8f97586df048"
      },
      {
        "path": ".github/skills/documentation-builder/SKILL.md",
        "bytes": 5388,
        "sha256": "d8dcdff9a580995f8ce1a328ad4b9783f74fca9f0cf9079c5404d5b36ad9add4"
      },
      {
        "path": ".github/skills/environment-update/SKILL.md",
        "bytes": 4149,
        "sha256": "1ab2c8e20277f103e8f38a9748cf7214462a4bf6d509ce455104d2f352f5e6be"
      },
      {
        "path": ".github/skills/framework-health-check/SKILL.md",
        "bytes": 3242,
        "sha256": "91b1d7401140d518914dc687a31f311369b5649988d26f464f0f07d0f9b26945"
      },
      {
        "path": ".github/skills/linkedin-post/SKILL.md",
        "bytes": 4611,
        "sha256": "6e3c7fce9f5bbddc52b4f9edb27f39716d04e732a384e8befe1d868bbab98cf1"
      },
      {
        "path": ".github/skills/multi-agent-coordinator/SKILL.md",
        "bytes": 2982,
        "sha256": "bf43fc45705d656fa28804d43f702eee48453f9f901ae11dabcd5bde142bd620"
      },
      {
        "path": ".github/skills/policy-engine/SKILL.md",
        "bytes": 2827,